algorithm,mean_rank,rank_order,n_paired_scenarios,metric,paired_key
RDHO-core,4.333333333333333,5,30,fitness,scenario_id + replicate_id
RDHO-core w/o hybrid RIME-DBO fusion,3.2,2,30,fitness,scenario_id + replicate_id
RDHO-core w/o dual-source initialization,7.0,7,30,fitness,scenario_id + replicate_id
RDHO-core w/o adaptive role allocation,4.366666666666666,6,30,fitness,scenario_id + replicate_id
RDHO-core w/o elite preservation,4.066666666666666,4,30,fitness,scenario_id + replicate_id
RDHO-core w/o dynamic penalty,3.8333333333333335,3,30,fitness,scenario_id + replicate_id
RDHO-full,1.2,1,30,fitness,scenario_id + replicate_id
